{
  "schema_version": 1,
  "seed_id": "seed-v1",
  "currency": "CNY",
  "description": "Fixed baseline for the procurement inventory Mini-ERP. Java initialization, the quotation site and acceptance checks share this file. Preserve the baseline and add a new seed_id for future datasets.",
  "suppliers": [
    {
      "supplier_id": "S001",
      "name": "Eastland Parts",
      "active": true,
      "contact": "Eastland Parts Purchasing"
    },
    {
      "supplier_id": "S002",
      "name": "Voyager Parts",
      "active": true,
      "contact": "Voyager Parts Purchasing"
    },
    {
      "supplier_id": "S003",
      "name": "Inactive Example Supplier",
      "active": false,
      "contact": "Inactive Example Purchasing"
    }
  ],
  "parts": [
    {
      "part_id": "P001",
      "sku": "BRAKE-01",
      "name": "Brake pad",
      "unit": "piece",
      "active": true
    },
    {
      "part_id": "P002",
      "sku": "FILTER-01",
      "name": "Air filter",
      "unit": "piece",
      "active": true
    },
    {
      "part_id": "P003",
      "sku": "CHAIN-01",
      "name": "Drive chain",
      "unit": "piece",
      "active": true
    },
    {
      "part_id": "P004",
      "sku": "SPARK-01",
      "name": "Spark plug",
      "unit": "piece",
      "active": true
    },
    {
      "part_id": "P005",
      "sku": "SEAL-01",
      "name": "Inactive oil seal",
      "unit": "piece",
      "active": false
    }
  ],
  "supplier_parts": [
    {
      "supplier_id": "S001",
      "part_id": "P001",
      "catalog_price": "25.50",
      "currency": "CNY",
      "lead_days": 3
    },
    {
      "supplier_id": "S001",
      "part_id": "P002",
      "catalog_price": "12.00",
      "currency": "CNY",
      "lead_days": 3
    },
    {
      "supplier_id": "S001",
      "part_id": "P003",
      "catalog_price": "68.00",
      "currency": "CNY",
      "lead_days": 7
    },
    {
      "supplier_id": "S001",
      "part_id": "P004",
      "catalog_price": "18.00",
      "currency": "CNY",
      "lead_days": 5
    },
    {
      "supplier_id": "S002",
      "part_id": "P001",
      "catalog_price": "24.00",
      "currency": "CNY",
      "lead_days": 4
    },
    {
      "supplier_id": "S002",
      "part_id": "P002",
      "catalog_price": "13.00",
      "currency": "CNY",
      "lead_days": 4
    },
    {
      "supplier_id": "S002",
      "part_id": "P004",
      "catalog_price": "17.50",
      "currency": "CNY",
      "lead_days": 6
    },
    {
      "supplier_id": "S003",
      "part_id": "P001",
      "catalog_price": "26.00",
      "currency": "CNY",
      "lead_days": 9
    }
  ],
  "inventory": [
    {
      "part_id": "P001",
      "on_hand": 8,
      "warning_threshold": 20,
      "target_stock": 50
    },
    {
      "part_id": "P002",
      "on_hand": 40,
      "warning_threshold": 15,
      "target_stock": 50
    },
    {
      "part_id": "P003",
      "on_hand": 5,
      "warning_threshold": 10,
      "target_stock": 20
    },
    {
      "part_id": "P004",
      "on_hand": 0,
      "warning_threshold": 10,
      "target_stock": 30
    },
    {
      "part_id": "P005",
      "on_hand": 30,
      "warning_threshold": 10,
      "target_stock": 40
    }
  ],
  "orders": [],
  "rejection_cases": {
    "inactive_supplier": "S003",
    "inactive_part": "P005",
    "unsupported_pair": {
      "supplier_id": "S002",
      "part_id": "P003"
    },
    "note": "Reject inactive supplier S003, inactive part P005, and the unsupported supply relation between S002 and P003."
  }
}
